<?xml version="1.0" encoding="UTF-8" ?>
<xs:schema xmlns:xs="http://www.w3.org/2001/XMLSchema">
    <xs:element name="dialog">
        <xs:complexType>
            <xs:sequence>
                <xs:element name="help" maxOccurs="unbounded">
                    <xs:complexType>
                        <xs:sequence>
                            <xs:element name="short" type="xs:string"/>
                            <xs:element name="full">
                                <xs:complexType>
                                    <xs:sequence maxOccurs="unbounded">
                                        <xs:element name="p" type="xs:string"/>
                                    </xs:sequence>
                                </xs:complexType>
                            </xs:element>
                        </xs:sequence>
                        <xs:attribute name="id" type="xs:string" use="required"/>
                        <xs:attribute name="title" type="xs:string" use="required"/>
                    </xs:complexType>
                </xs:element>
            </xs:sequence>
            <xs:attribute name="id" type="xs:string" use="required"/>
            <xs:attribute name="title" type="xs:string" use="required"/>
        </xs:complexType>
    </xs:element>
</xs:schema>